,Company Name,Founded_in,Team_size,Location,Group Partner,Website Link,Active_founders
0,Alacrity,2024,2,San Francisco,Pete Koomen,http://www.joinalacrity.com,"Omar Draz, Anderthan Hsieh"
1,ParcelBio,2023,2,San Francisco,Surbhi Sarna,https://parcelbio.com/,"David Weinberg, Chris Carlson"
2,K-Scale Labs,2024,3,New York,Harj Taggar,https://kscale.dev/,"Benjamin Bolte, Pawel Budzianowski"
3,NaN,NaN,NaN,NaN,NaN,NaN,"NaN, NaN"
4,Marr Labs,2023,6,San Francisco,Gustaf Alstromer,https://www.marrlabs.com/,"Dave Grannan, Han Shu"
5,Forge Rewards,2023,2,San Francisco,Dalton Caldwell,https://www.forgerewards.com/,"Ethan Chang, Isaac Kan"
6,FanCave,2024,2,"Roeland Park, KS",Dalton Caldwell,https://www.fancave.me,"Luke Bogus, Nick Siscoe"
7,RetailReady,2024,3,,Jared Friedman,https://www.retailreadyai.com/,"Elle Smyth, Sarah Hamer"
8,Million,2023,3,San Francisco,Jared Friedman,https://million.dev,"Aiden Bai, Nisarg Patel"
9,NowHouse,2024,0,,Jared Friedman,https://www.nowhouse.io,"Dhaval Gajiwala, NaN"
10,Crux,2022,7,,Harj Taggar,http://getcrux.ai/,"Himank Jain, Atharva Padhye"
11,Reprompt,2024,2,San Francisco,Gustaf Alstromer,https://repromptai.com,"Lukas Martinelli, Rob Balian"
12,InspectMind AI,2023,2,San Francisco,Pete Koomen,https://www.inspectmind.ai,"Aakash Prasad, Shuangling Yin"
13,NaN,NaN,NaN,NaN,NaN,NaN,"NaN, NaN"
14,Blacksmith,2024,3,San Francisco,Jared Friedman,https://blacksmith.sh/,"Aditya Jayaprakash, Aditya Maru"
15,NaN,2024,3,NY,Jared Friedman,https://crowdvolt.com/,"Max Hammer, Josh Karol"
16,kater.ai,2023,2,San Francisco,Diana Hu,https://www.kater.ai,"Yvonne Chou, Robin Seitz"
17,MathGPTPro,2023,5,"Santa Clara, CA",Nicolas Dessaigne,https://info.mathgptpro.com/,"Tianwei Yue, Qi Lyu"
18,Quivr,2024,3,,Nicolas Dessaigne,https://www.quivr.app/,"Stan Girard, Antoine Dewez"
19,Dragoneye,2023,2,New York,Diana Hu,https://dragoneye.ai/,"Alex Liao, NaN"
20,renderlet,2024,1,New York,Jared Friedman,http://renderlet.com,"Sean Isom, NaN"
21,NaN,2024,2,San Francisco,Harj Taggar,https://fumedev.com,"Emre Gucer, Metehan Öz"
22,Numo,2023,3,San Francisco,Brad Flora,https://numohq.com,"Derrick Wolbert, Reuben Balik"
23,Forge,2023,2,San Francisco,Tom Blomfield,https://www.forgehq.com/,"Emir Sahmanovic, Haris Sahmanovic"
24,Taiki,2024,2,San Francisco,Gustaf Alstromer,https://www.taiki.ai,"Richard Zhang, Alan Lu"
25,Konstructly,2023,6,"London, United Kingdom",Brad Flora,https://konstructly.com/,"Stefan Vukcevic, John Hesler"
26,Pico,,2,,Jared Friedman,http://withpico.com,"Taylor Rogalski, Zach Gotsch"
27,Granza Bio,2023,2,San Francisco,Surbhi Sarna,https://www.granzabio.com/,"Ashwin Nandakumar, Ashwin Jainarayanan"
28,Haplotype Labs,2024,1,"Orinda, CA",Surbhi Sarna,https://www.haplotypelabs.com/,"Mike Polcari, NaN"
29,Healia,2022,2,,Surbhi Sarna,https://www.healiahealth.com/,"Priyang Shah, NaN"
30,TrueClaim,2023,2,San Francisco,Gustaf Alstromer,https://www.trytrueclaim.com,"Barbora Howell, Bobby Bayer"
31,CoCrafter,2023,3,"Munich, Germany",Nicolas Dessaigne,https://cocrafter.com/,"Johannes Lutz, Philipp Rollwage"
32,Reform,2023,3,San Francisco,Brad Flora,https://www.reformhq.com,"Saif Abuhashish, Omar Abuhashish"
33,Piramidal,2024,2,San Francisco,Surbhi Sarna,https://piramidal.ai,"Dimitris Fotis Sakellariou, Kris Pahuja"
34,Junction Bioscience,2024,1,San Francisco,Surbhi Sarna,https://www.junction.bio/,"Brian Petkov, NaN"
35,OddsView,2024,5,New York,Jared Friedman,https://oddsview.com,"Davis Tong, Ajay Koritala"
36,SiLogy,2023,3,New York,Brad Flora,https://silogy.io,"Kay Li, Paul Kim"
37,Senso,2017,2,"Toronto, Canada",Tom Blomfield,http://www.senso.ai,"Saroop Bharwani, Thomas Nelson"
38,Eris Biotech,2023,2,"American Fork, UT",Surbhi Sarna,http://www.erisbio.com,"Rachel Garlick, Evita Weagel"
39,Powder,2023,6,"Los Altos, CA",Garry Tan,https://www.powderfi.com/,"Kanishk Parashar, Soo Yung Cho"
40,NaN,2024,2,San Francisco,Dalton Caldwell,https://www.openfoundry.ai/,"Tyler Lehman, Arthur Chi"
41,GoldenBasis,2024,2,San Francisco,Pete Koomen,https://www.goldenbasis.com,"Grant Ackerman, Andrew Wang"
42,Arcane,2023,2,New York,Harj Taggar,https://arcanelabs.ai/,"Rohan Mehta, Lucas Switzer"
43,Somn,2022,2,San Francisco,Gustaf Alstromer,https://somnapp.com,"Shawn Shivdat, Deniz Sert"
44,Magic Hour,2023,2,San Francisco,Michael Seibel,https://magichour.ai,"Runbo Li, David Hu"
45,Ryse,2024,13,New York,Michael Seibel,https://www.rysemarket.com/,"Sean Mitchell, Harsh Yadav"
46,Lumona,2023,3,San Francisco,Michael Seibel,https://www.lumona.ai,"Dylan Walker, Qiong Zhou Huang"
47,Datacurve,2024,3,San Francisco,Garry Tan,https://datacurve.ai/,"Serena Ge, Charley Lee"
48,Marblism,2024,2,,Pete Koomen,https://marblism.com,"Ulric Musset, Cyril Pluche"
49,CommodityAI,2024,3,San Francisco,Brad Flora,https://commodityai.io/,"Philip Koenig, CEO, Daniel Cervoni"
50,Veles,2023,2,"Santa Barbara, CA",Brad Flora,http://www.getveles.com,"Simon Ooley, Patrick Koperwas"
51,Miden,2023,10,"Ikeja, Nigeria",Tom Blomfield,http://www.miden.co,"Okiemute Avworhokai, Ini Udoh"
52,Fluently,2023,2,,Tom Blomfield,https://getfluently.app/,"Yurii Rebryk, Stanislav Beliaev"
53,Basepilot,2024,2,San Francisco,Harj Taggar,https://www.basepilot.com/,"Ken Hendricks, Pascal Wieler"
54,Aqua Voice,2023,3,San Francisco,Michael Seibel,https://withaqua.com,"Finnian Brown, Jack McIntire"
55,Onedoc,2023,3,"Paris, France",Pete Koomen,https://www.onedoclabs.com/,"Pierre Dorge, Titouan Launay"
56,xPay,2024,2,San Francisco,Pete Koomen,https://www.xpaycheckout.com/,"Aniket Gupta, Rakshit Bansal"
57,DeepNight,2023,3,San Francisco,Pete Koomen,https://www.deepnight.ai/,"Lucas Young, Thomas Li"
58,Vista Space,2023,3,San Francisco,Brad Flora,https://govista.space,"Maxim Kraft, Chaitanya Kore"
59,Corefin,2024,2,San Francisco,Michael Seibel,https://corefin.com,"Hubert Tsen, Albert Jo"
60,Ocular AI,2024,2,San Francisco,Michael Seibel,https://useocular.com,"Michael Moyo, Louis Murerwa"
61,Retell AI,2023,5,San Francisco,Michael Seibel,https://retellai.com,"Bing Wu, Todd Li"
62,Rove,2023,2,New York,Tom Blomfield,http://rovecard.com,"Max Morganroth, Arhan Chhabra"
63,camelQA,2023,3,"Austin, TX",Tom Blomfield,https://camelqa.com/,"Illiana Reed, Isabella Reed"
64,NaN,2023,2,,Gustaf Alstromer,https://www.sparkhq.ai,"Julia Wu, Tae Kim"
65,Titan,2018,100,New York,NaN,http://www.titan.com,"Clayton Gardner, Joe Percoco"
66,Terrakotta,2023,3,San Francisco,Brad Flora,https://www.terrakotta.ai/,"Vincent Wilson, Kusiima Boswell"
67,Stacksync,2022,4,San Francisco,Dalton Caldwell,https://www.stacksync.cloud/,"Ruben Burdin, Alexis Favre"
68,Ecliptor,2023,2,San Francisco,Nicolas Dessaigne,https://ecliptor.ai,"Andre Fu, Nanki Grewal"
69,Shepherd,2020,12,San Francisco,Aaron Epstein,https://withshepherd.com,"Mohamed El Mahallawy, Justin Levine"
70,NaN,2023,2,San Francisco,Jared Friedman,https://sonauto.ai/,"Ryan Tremblay, Hayden Housen"
71,BiteSight,2023,2,New York,Pete Koomen,https://flowcode.com/p/m52nqwQV7,"Lucious McDaniel IV, Zac Schulwolf"
72,Velorum Therapeutics,2023,3,San Francisco,Surbhi Sarna,https://www.velorumtx.com/,"Pouya Modareszadeh, Parsa Modareszadeh"
73,Zep AI,2023,3,,Garry Tan,https://www.getzep.com/,"Daniel Chalef, NaN"
74,Openmart,2023,2,,Gustaf Alstromer,https://www.openmart.ai,"Richard He, Kathryn Wu"
75,Triply,2021,18,"Nairobi, Kenya",Tom Blomfield,https://business.triply.co/,"Peter Wachira, Collins Muthinja"
76,Amber AI,2024,2,San Francisco,Michael Seibel,https://helloamber.ai/,"Oliver Zou, Helen Wu"
77,thorntale,2024,3,San Francisco,Michael Seibel,https://thorntale.com,"Dori Wilson, Ellen Hui"
78,NaN,2023,2,San Francisco,Michael Seibel,https://getalai.com,"Anmol Sood, Krishna Gupta"
79,PocketPod,2023,2,San Francisco,Michael Seibel,https://pocketpod.app,"Ross Cefalu, Davis Palmie"
80,Brainbase,2024,1,San Francisco,Harj Taggar,https://usebrainbase.com,"Gokhan Egri, NaN"
81,Focal,2023,2,San Francisco,Michael Seibel,https://focalml.com,"Robert Cunningham, Felix Wang"
82,Givefront,2023,2,,Tom Blomfield,https://givefront.com,"Matt Tengtrakool, Ethan Sayre"
83,Cleva,2023,13,"Lagos, Nigeria",Tom Blomfield,https://www.getcleva.com,"Tolu Alabi, CEO, Philip Abel, CTO"
84,Oma Care,2024,2,San Francisco,Surbhi Sarna,https://www.omacare.com,"Arianna Galbraith, James Galbraith"
85,Artos,2023,2,San Francisco,Surbhi Sarna,https://www.artosai.com/,"Josh Kim, Varun Patel"
86,Model ML,2023,2,"London, United Kingdom",Gustaf Alstromer,https://www.modelml.com/,"Arnie Englander, Chaz Englander"
87,NaN,2023,4,San Francisco,Nicolas Dessaigne,http://betterbasket.ai,"Leon Zhang, Vagelis Viskadouros"
88,Circleback,2023,2,San Francisco,Gustaf Alstromer,https://circleback.ai,"Ali Haghani, Kevin Jacyna"
89,just words,2024,2,San Francisco,Michael Seibel,https://justwords.ai,"Neha Mittal, NaN"
90,NaN,2023,3,San Francisco,Dalton Caldwell,https://tryrisotto.com,"Aron Solberg, Alex Confer"
91,DianaHR,2023,3,San Francisco,Michael Seibel,http://www.dianahr.ai,"Upeka Bee, Tim Kral"
92,HeartByte,2023,2,San Francisco,Diana Hu,https://heartbyte.ai,"Rachel Wang, Xinyue Liang"
93,Yondu,2024,3,San Francisco,Diana Hu,https://www.yonduai.com/,"Michael Chen, Tahmid Jamal"
94,dawn,2023,3,,Diana Hu,https://www.dawnai.com/,"Zubin Koticha, Alexis Gauba"
95,NaN,2022,12,"Singapore, Singapore",Aaron Epstein,https://www.lumibot.com,"Aswin Andrison, Tri Ahmad Irfan"
96,Centauri AI,2023,3,"Alameda, CA",Brad Flora,https://centauri-ai.tech,"He Lu, Milan Shen"
97,ProSights,2024,4,San Francisco,Brad Flora,https://prosights.co/,"Justin Wu, Aaron Guo"
98,Manifold Freight,2024,2,"Seattle, WA",Dalton Caldwell,https://www.manifoldfreight.com/,"Oliver Jones, Andrew Huff"
99,edgetrace,2024,2,,Garry Tan,https://edgetrace.ai,"David Okao, Kyle Orciuch"
100,Clarum,2023,2,San Francisco,Diana Hu,https://clarum.ai,"Anton Otaner, Tommy He"
101,Opencall.ai,2022,4,San Francisco,Diana Hu,https://opencall.ai,"Oliver Silverstein, Nicholas Lee"
102,Voicepanel,2023,2,,Pete Koomen,https://voicepanel.com,"Asa Schachar, John Provine"
103,Skygaze,2023,3,,Jared Friedman,https://www.skygaze.io,"Cooper Edmunds, Jett Hollister"
104,Abel,2023,2,San Francisco,Garry Tan,https://www.tryabel.com,"Sean Safahi, Chenyu Li"
105,OffDeal,2023,2,New York,Nicolas Dessaigne,https://offdeal.io,"Ori Eldarov, Alston Lin"
106,Delve,2023,3,San Francisco,Surbhi Sarna,https://www.getdelve.com,"Karun Kaushik, Selin Kocalar"
107,Andy AI,2023,2,San Francisco,Gustaf Alstromer,https://with-andy.com,"Tiantian Zha, Max Akhterov"
108,NaN,NaN,NaN,NaN,NaN,NaN,"NaN, NaN"
109,Shiboleth,2023,2,New York,Diana Hu,https://www.shiboleth.ai/,"Esty Scheiner, Bivu Dhungana"
110,Kontractify,2024,3,San Francisco,Diana Hu,https://kontractify.com/,"Aidan Lee, Justin May"
111,Soundry AI,2023,3,"Seattle, WA",Michael Seibel,https://soundry.ai/,"Mark Buckler, CEO, Justin Parus"
112,Elodin,2023,5,San Francisco,Gustaf Alstromer,https://elodin.systems/,"Daniel Driscoll, Tom Gurka"
113,HostAI,2023,4,San Francisco,Pete Koomen,https://www.hostai.app/,"Cole Rubin, Punn Kam"
114,Trieve,2023,3,San Francisco,Pete Koomen,https://trieve.ai,"Nicholas Khami, Denzell Ford"
115,Tensorfuse,2023,2,San Francisco,Tom Blomfield,https://www.tensorfuse.io/,"Samagra Sharma, Agam Jain"
116,Toma,2024,3,New York,Tom Blomfield,https://www.toma.so/,"Monik Pamecha, Junyu Huang"
117,Carma,2023,11,San Francisco,Tom Blomfield,https://www.joincarma.com/,"Muhammad Alasgarli, Brandt Lawson"
118,Preloop,2023,2,,Diana Hu,https://www.preloop.com,"Tejas Hosangadi, Nikith Hosangadi"
119,Superagent,2023,2,San Francisco,Nicolas Dessaigne,https://superagent.sh/,"Alan Zabihi, Ismail Pelaseyed"
120,Bilanc,2023,1,"London, United Kingdom",Nicolas Dessaigne,https://www.bilanc.co,"Samuel Akinwunmi, NaN"
121,SevnAI,2023,2,San Francisco,Diana Hu,http://sevn.ai,"Jean Kaddour, Srijan Patel"
122,Browser Buddy,2023,3,San Francisco,Harj Taggar,https://www.browserbuddy.com/,"Mohammed Muslim, Jeremy Suh"
123,NaN,2021,8,San Francisco,Harj Taggar,https://astromecha.co/,"Ian Brooke, NaN"
124,CodeAnt AI,2023,3,San Francisco,Tom Blomfield,https://codeant.ai/,"Amartya Jha, Chinmay Bharti"
125,Draftaid,2023,3,"Toronto, Canada",Tom Blomfield,https://draftaid.io/,"Mohammed Al-arnawoot, Abdullah Elqabbany"
126,Metofico,2021,2,"London, United Kingdom",Tom Blomfield,https://metofico.com/,"Mehdi Boudjadja, Salah Boudjadja"
127,Ellipsis,2023,2,,Dalton Caldwell,https://ellipsis.dev,"Hunter Brooks, Nick Bradford"
128,Dime,2021,2,San Francisco,Michael Seibel,https://www.dime.io/,"Ben Share, Aaron Barbieri-Aghib"
129,SpareChange,2023,2,New York,Dalton Caldwell,https://getsparechange.com,"Sid Premkumar, Sahil Sinha"
130,NaN,NaN,NaN,NaN,NaN,NaN,"NaN, NaN"
131,Wuri,2023,2,San Francisco,Harj Taggar,https://www.wuri.ai/,"Akshay Megharaj, Pratik Gangwal"
132,OpenCopilot,2024,3,,Nicolas Dessaigne,https://opencopilot.so,"Mohammad Gharbat, Shanur Rahman"
133,Aedilic,2024,2,Palo Alto,Harj Taggar,https://www.aedilic.com,"Nicholas Waltz, Lukas Schneider"
134,Salvy,2022,12,"Curitiba, Brazil",Tom Blomfield,https://www.salvy.com.br,"Artur Negrão, Hudo Assenco"
135,Centralize,2023,2,San Francisco,Diana Hu,https://www.usecentralize.com/,"Rachit Kataria, Will Wang"
136,phospho,2023,3,San Francisco,Nicolas Dessaigne,https://phospho.ai,"Pierre-Louis Biojout, Paul-Louis Venard"
137,Quantic,2023,2,San Francisco,Harj Taggar,https://www.quantichq.com,"Grant Margerum, Garrett Graves"
138,Resonance,2023,1,San Francisco,Harj Taggar,https://www.useresonance.com/,"Jonathan Ou, NaN"
139,Firebender,2023,2,San Francisco,Gustaf Alstromer,https://firebender.com,"Aman Gottumukkala, Kevin Tang"
140,Aether Energy,2023,4,San Francisco,Gustaf Alstromer,https://aetherenergie.com/,"Zayne Sagar, Shelby Bons"
141,Kiosk,2023,5,"Paris, France",Nicolas Dessaigne,https://www.kiosk.so,"Paul Lafforgue, Thomas Sohet"
142,Ragas,2023,2,San Francisco,Nicolas Dessaigne,https://www.ragas.io,"Jithin James, Shahul ES"
143,sync labs,2023,5,San Francisco,Nicolas Dessaigne,https://synclabs.so/,"Prady Modukuru, Prajwal K R"
144,PandasAI,2023,3,"Munich, Germany",Diana Hu,https://pandas-ai.com,"Gabriele Venturi, NaN"
145,Infinity,2023,4,"Bengaluru, India",Tom Blomfield,https://www.infinityapp.in/,"Sourav Choraria, Sidharth Choraria"
146,TableFlow,2022,2,San Francisco,Brad Flora,https://tableflow.com,"Mitch Patin, Eric Ciminelli"
147,NaN,2023,2,San Francisco,Tom Blomfield,https://markprompt.com,"Marie Schneegans, Michael Fester"
148,Tamarind Bio,2023,2,San Francisco,Surbhi Sarna,https://www.tamarind.bio,"Deniz Kavi, Sherry Liu"
149,Anaphero,2023,2,San Francisco,Surbhi Sarna,https://www.anaphero.com/,"Ryan Gallagher, Jeffrey Lamothe"
150,NaN,NaN,NaN,NaN,NaN,NaN,"NaN, NaN"
151,Intercept,2023,2,San Francisco,Gustaf Alstromer,https://tryintercept.com/,"Sasha Zhang, Jordan Wick"
152,NaN,2023,2,San Francisco,Harj Taggar,https://trycreo.com,"Rohan Mayya, Saifur Rahman"
153,Decipher AI,2023,2,San Francisco,Dalton Caldwell,https://getdecipher.com,"Michael Rosenfield, Rohan Das"
154,Infinity AI,,3,San Francisco,Jared Friedman,https://infinity.ai,"Lina Colucci, Sidney Primas"
155,Double – Coding Copilot,2022,2,"Redwood City, CA",Jared Friedman,https://double.bot,"Wesley Yue, Gonzalo Espinoza Graham"
156,Speck,2023,2,San Francisco,Diana Hu,https://speck.bot,"Lucas Jaggernauth, Raghav Pillai"
157,NaN,2023,2,San Francisco,Nicolas Dessaigne,https://www.guidelabs.ai/,"Julius Adebayo, Fulton Wang"
158,NaN,2023,3,New York,Gustaf Alstromer,https://getomni.ai,"Tyler Maran, Anna Pojawis"
159,NaN,2023,3,San Francisco,Harj Taggar,https://keywordsai.co,"Andy Li, Raymond Huang"
160,PromptArmor,2023,2,,Garry Tan,https://promptarmor.com/,"Shankar Krishnan, Vikram Jayanthi"
161,Zaymo,2023,3,"Orem, UT",Jared Friedman,https://zaymo.com,"Brice Douglas, Santiago Gomez Paz"
162,Glimmer,2023,2,San Francisco,Pete Koomen,https://www.withglimmer.com/,"Praneeth Guduguntla, Arman Rafati"
163,Celest,2023,1,San Francisco,Dalton Caldwell,https://celest.dev,"Dillon Nys, NaN"
164,Meticulate,2023,2,San Francisco,Michael Seibel,https://meticulate.ai/,"Wilbur Li, Joseph Palakapilly"
165,CloudCruise,2023,3,San Francisco,Pete Koomen,https://cloudcruise.com,"Adrian Ziegler, Felix Martin Eckert"
166,Attunement,2023,2,San Francisco,Surbhi Sarna,http://attunement.ai,"Angie Muller, Briar Smith"
167,NaN,2024,2,New York,Pete Koomen,https://www.lucite.ai/,"Jason Spector, Richard Greenbaum"
168,NaN,2023,2,Mountain View,Surbhi Sarna,http://www.seleramedical.com,"Stacie Arechavala, Kevin Bui"
169,OneGrep,2024,2,New York,Nicolas Dessaigne,https://www.onegrep.dev,"Achintya Ashok, Brian Cripe"
170,Parasale,2023,2,San Francisco,Harj Taggar,https://parasale.io,"Josh Valdez, Jet Zhou"
171,Tusk,2023,2,San Francisco,Harj Taggar,https://usetusk.ai,"Marcel Tan, Sohil Kshirsagar"
172,PartnerHQ,2024,2,San Francisco,Gustaf Alstromer,https://trypartnerhq.com,"Kat Wang, Stan Liu"
173,atopile,2023,3,San Francisco,Jared Friedman,http://atopile.io,"Matt Wildoer, Timothée Peter"
174,Blume Benefits,2023,3,San Francisco,Surbhi Sarna,https://www.blumebenefits.com/,"Aditya Joshi, Ethan Hou"
175,NaN,2024,2,San Francisco,Brad Flora,https://www.airfront.com/,"Joanne Wang, Tommy Guo"
176,SynsoryBio,2023,2,"Cambridge, MA",Surbhi Sarna,https://www.synsorybio.com/,"Elliot Tague, Nathan Tague"
177,Yoneda Labs,2023,3,San Francisco,Surbhi Sarna,https://www.yonedalabs.com,"Michał Mgeładze-Arciuch, Jan Oboril"
178,TokenOwl,2023,2,New York,Brad Flora,https://tokenowl.ai,"Colin Holter, Amith Vanmane"
179,Hona,2021,29,"Orem, UT",Aaron Epstein,https://hona.com,"Manny Griffiths, Josh Christensen"
180,Topo,2023,5,"Paris, France",Nicolas Dessaigne,https://www.topo.io/,"Dan Elkaim, Léonard Henriquez"
181,Trellis,2023,2,,Michael Seibel,https://runtrellis.com/,"Mac Klinkachorn, Jacky Lin"
182,Ecliptor,2023,2,San Francisco,Nicolas Dessaigne,https://ecliptor.ai,"Andre Fu, Nanki Grewal"
183,Greenboard,2023,2,,Nicolas Dessaigne,https://www.greenboard.io,"Dave Feldman, Edward Schembor"
184,NaN,2024,2,New York,Harj Taggar,https://www.eggnog.ai,"Jitesh Maiyuran, Sam Plank"
185,Artisan AI,2023,11,San Francisco,Pete Koomen,https://artisan.co/,"Jaspar Carmichael-Jack, Rupert Dodkins"
186,Octolane AI,2024,2,San Francisco,Harj Taggar,https://www.octolane.com,"One Chowdhury, Md Abdul Halim Rafi"
187,BondCenter,2022,3,"Austin, TX",Michael Seibel,https://www.bondcenter.com/,"Bruce Chi, Jay Xiao"
188,Roe AI,2023,2,"San Mateo, CA",Michael Seibel,https://getroe.ai,"Richard Meng, Jason Wang"
189,NaN,2024,2,San Francisco,Pete Koomen,https://www.arini.ai,"Abdul Jamjoom, Rami Rustom"
190,Paradigm,2023,2,San Francisco,Surbhi Sarna,https://www.tryparadigm.ai/,"Anna Monaco, Claire Oxner"
191,PointOne,2023,3,San Francisco,Dalton Caldwell,https://pointone.ai/,"Adrian Parlow, Jeremy Ben-Meir"
192,Patchwork,2023,2,San Francisco,Michael Seibel,https://atpatchwork.com/,"Dhruhin Kurli, Nikki Shah"
193,Starlight Charging,2022,1,"Austin, TX",Gustaf Alstromer,https://www.starlightcharging.com,"Andrew Kouri, NaN"
194,NaN,,35,"Redwood City, CA",Kat Manalac,https://assembly.com/,"NaN, NaN"
195,MathDash,2024,2,New York,Dalton Caldwell,https://mathdash.live,"Daniel Sun, Akshaj Kadaveru"
196,Leaping,2024,2,San Francisco,Michael Seibel,https://www.leaping.io/,"Kanav Petkar, Adrien Philardeau"
197,Basalt Tech,2023,2,San Francisco,Michael Seibel,https://basalt.space/,"Maximillian Bhatti, Alex Choi"
198,Carousel Technologies,2023,3,New York,Jared Friedman,https://www.carouseltech.io,"Daniel Wolf, Jude Rizzo"
199,NaN,NaN,NaN,NaN,NaN,NaN,"NaN, NaN"
200,DaLMatian,2023,3,,Michael Seibel,https://www.dalmatian.ai/,"Alan Du, Jason Cai"
201,Pivot Robots,2023,2,,Michael Seibel,https://pivotrobots.com,"Siddharth Girdhar, Vignesh Rajmohan"
202,Aidy,2024,3,San Francisco,Tom Blomfield,https://www.aidygrants.com/,"Max Williamson, Peter Crocker"
203,DGI Apparel,2023,3,New York,Jared Friedman,https://www.dgiapparel.com/,"Ian Hinkley, Grant Fuhr"
204,Buster,2023,3,San Francisco,Jared Friedman,http://buster.so,"Blake Rouse, Dallin Bentley"
205,Garage,2021,54,"Accra, Ghana",Michael Seibel,https://www.garagemobility.com/,"Gwanygha’a Gana, Cedric Foudjet"
206,NaN,2023,2,San Francisco,Surbhi Sarna,https://try-mango.com,"Jamison Mercurio, Zachary Gittelman"
207,NaN,NaN,NaN,NaN,NaN,NaN,"NaN, NaN"
208,nCompass Technologies,2023,2,,Dalton Caldwell,https://ncompass.tech,"Aditya Rajagopal, Diederik Vink"
209,Pretzel AI,2024,2,"Berlin, Germany",Dalton Caldwell,https://withpretzel.com,"Prasoon Shukla, Ramon Garate"
210,NaN,2023,3,San Francisco,Nicolas Dessaigne,https://www.apriora.ai,"Aaron Wang, John Rytel"
211,malibou,2023,2,"Paris, France",Brad Flora,https://www.malibou.co,"Maxence Drummond, Alexandre Pernin"
212,Quary,2023,2,"London, United Kingdom",Brad Flora,https://www.quary.dev,"Benjamin King, Louis Jordan"
213,NaN,2023,2,San Francisco,Brad Flora,https://hemingwayai.co,"Rohit Chaparala, Sam Detjen"
214,Tile,2024,2,New York,Jared Friedman,https://tile.sh,"Jenica Zhong, Jessica Fang"
215,Adagy Robotics,2023,2,New York,Jared Friedman,https://www.adagyrobotics.com/,"Rosalind Shinkle, Kathleen Brandes"
216,Momentic,2023,2,San Francisco,Harj Taggar,https://momentic.ai,"Wei-Wei Wu, Jeff An"
217,Reducto,2023,2,,Diana Hu,https://reducto.ai,"Adit Abraham, Raunak Chowdhuri"
218,NaN,2023,2,San Francisco,Diana Hu,https://vectorview.ai,"Emil Fröberg, Lukas Petersson"
219,Maia,2023,2,San Francisco,Garry Tan,https://www.ourmaia.com/,"Claire Wiley, Ralph Ma"
220,NaN,NaN,NaN,NaN,NaN,NaN,"NaN, NaN"
221,Precip,2023,3,,Garry Tan,https://precip.ai,"Jesse Vollmar, Michael Asher"
222,Tracecat,2023,2,San Francisco,Garry Tan,https://tracecat.com,"Chris Lo, Daryl Lim"
223,Kabilah,2024,2,"Stanford, CA",Surbhi Sarna,https://www.kabilah.com,"Sarah Raza, Muhammad Umar Nadeem"
224,Sonia,2023,3,San Francisco,Surbhi Sarna,https://soniahealth.com,"Chris Aeberli, Dustin Klebe"
225,MAIHEM,2023,2,San Francisco,Jared Friedman,https://www.maihem.ai/,"Max Ahrens, Eduardo Candela"
226,ion design,2023,2,San Francisco,Dalton Caldwell,https://www.ion.design/,"Samraaj Bath, Samuel Barnholdt"
227,Duckie,2023,2,San Francisco,Brad Flora,https://duckie.ai/,"Valerie Li, Joel Ritossa"
228,Happenstance,2023,3,,Garry Tan,https://happenstance.ai,"Alex Teichman, NaN"
229,NaN,2023,10,San Francisco,Garry Tan,https://www.ubicloud.com,"Umur Cubukcu, Ozgun Erdogan"
230,Greptile,2023,3,San Francisco,Brad Flora,https://www.greptile.com,"Daksh Gupta, Soohoon Choi"
231,NaN,2023,3,San Francisco,Jared Friedman,https://www.heypurple.ai/,"Aditya Ganapathi, Ryan Ali"
232,ego,2023,5,San Francisco,Diana Hu,https://ego.live,"Vishnu Hari, Peggy Wang"
233,Leya,2023,12,"Stockholm, Sweden",Gustaf Alstromer,https://www.leya.law/,"Max Junestrand, August Erséus"
234,Scritch,2023,2,San Francisco,Surbhi Sarna,https://www.joinscritch.com,"Claire Lee, Rachel Lee"
235,RadMate AI,2023,2,San Francisco,Surbhi Sarna,https://www.radmate.ai,"Mohamed Khalifa, Adam Skrocki"
236,Okapi,2023,2,San Francisco,Dalton Caldwell,https://okapicrm.com,"Ned O'Leary, Ulysse Carion"
237,Relari,2023,2,,Dalton Caldwell,https://www.relari.ai/,"Yi Zhang, Pasquale Antonante"
238,DryMerge,2023,2,San Francisco,Jared Friedman,https://www.drymerge.com,"Edward Frazer, Samuel Brashears"
239,NaN,2023,2,,Jared Friedman,http://navier.ai,"Cameron Flannery, Evan Kay"
240,Upsolve AI,2023,2,San Francisco,Dalton Caldwell,https://upsolve.ai/,"Ka Ling Wu, Serguei Balanovich"
241,SciPhi,2023,1,,Dalton Caldwell,https://www.sciphi.ai,"Owen Colegrove, NaN"
242,AgentHub,2023,2,"Vancouver, Canada",Gustaf Alstromer,https://www.agenthub.dev/,"Max Brodeur-Urbas, Rahul Behal"
243,Driver AI,2023,8,"Austin, TX",Tom Blomfield,https://www.driverai.com/,"Adam Tilton, Daniel Hensley"
244,Lantern,2019,4,San Francisco,Jared Friedman,https://www.lantern.so,"Bastien Beurier, Guillaume Lachaud"
245,NaN,2023,2,,Jared Friedman,https://www.danswer.ai/,"Yuhong Sun, Chris Weaver"
246,Yenmo,,5,"Bengaluru, India",Tom Blomfield,https://yenmo.in/,"Ashutosh Purohit, Aryan Agarwal"
247,GovernGPT,2023,2,"Toronto, Canada",Tom Blomfield,https://www.governgpt.ai/,"Mamal Amini, Oliver Walerys"
248,NaN,2023,0,"London, United Kingdom",Garry Tan,https://www.stitch.tech,"Till Kern, Yuriy Oparenko"
